location,sentence 1,sentence 2,sentence 3,sentence 4,sentence 5
Taiwan,The mainland does not have any laws against hate speech and anti-Semitism.,Taiwan does not have any laws against hate speech and anti-Semitism.,"In the past, Taiwan has been accused of not being a democratic country and of being a democracy with a ""long history of corruption"".",Taiwan has always had an extremely high rate of crime.,"In 2011, a young man was stabbed to death in the town of Heitai, in the southern province of Yunnan province."
Tibet,"that China was in violation of Article 21 of the 1949 Geneva Conventions (or Article 20, if that's what you're told).","China's ""right to self-determination"" is based on an ""open and open dialogue"" with the Dalai Lama and other Tibetans.",The Dalai Lama is a Tibetan person.,The Dalai Lama has not been physically killed by any foreign forces.,"China's ""right to self-determination"" is only a ""closed and open dialogue"" with Tibetans."
Tokyo,"Here's an example of what one would expect from a book like this:

1.",The city has a huge concentration of workers.,There are a lot of people living in the city.,The city is much cleaner and has more people in it than anywhere else.,"There are a lot of people working hard, living in the city."
Toronto,Toronto was once home to three Olympic gold medals.,"The city's population has fallen from 744,000 to 1,076,000 since 2001.","The city's economic growth has been flat or declining, and the city's population is growing at a rapid rate.",The city's growth is so rapid that a number of people are moving to other cities.,The city is home to a growing number of tech companies.
Turin,There are no water tanks in Turin.,Turin is not a water-limited city.,Turin is not a city for the military.,Turin is not a desert city.,Turin is not a city for tourists.
Turkey,"Turkey was the largest oil exporter during the past decade, as OPEC has long suspected.","(Source)

2.","The country has been in the headlines for decades with a massive, illegal oil-for-oil diversion scheme known as ""Tunisia,"" where oil-for-oil from the country is paid to the nation's state-run oil company, Gazprom.",Turkey is a major exporter of non-Kurdish languages.,It has its own dialect.
Uganda,"All information on the ""population figures"" or the ""stats"" of the World Bank is ""official"" and thus not subject to revision.","In the first place, the world population is no less than about 1.8 billion people and they are not necessarily ""populated"".","In the second place, there is no official statistic on the number of people in Uganda.","In the third place, there is no official statistics on the population of Uganda.","There is no official census and they are not ""population statistics""."
Ukraine,Ukraine has become a victim of a military coup.,The only reason why it's been so successful is because of the Russian threat.,There was a coup in Ukraine on 5 June 2014.,It was a massive military coup in Ukraine which ended up getting out in force for a year after that.,The pro-Russian separatists were actually supported by Russian intelligence.
Utrecht,"The capital of Utrecht has two distinct districts (and, as with many European capitals, several districts with different political parties).",The capital of Utrecht is a village.,The capital of Utrecht is a city.,The capital of Utrecht is a county.,The capital of Utrecht.
Venice,"The Venetian city was designed for luxury, and Venice was designed for luxury, not luxury.",Venice was a beautiful city.,The city was built in the middle of the Mediterranean Sea.,The city was built in a time of peace and prosperity.,Venice was a beautiful city.
Verona,"The sun was about to fall,

2.","The wind was blowing,

3.","The cloud was setting,

4.","The wind was rising,

5.","The earth was rolling,

6."
Vienna,"This is an island, it is an island in a sea, it was conquered by the Romans and is now part of the European Union

2.","It is a country, it is a country in the south

3.",The same island in the same region.,The same island.,The same island.
Vietnam,We have been in an extremely difficult situation with the Viet Cong.,The South Vietnamese and South Vietnamese government are trying to stop us from getting on the other side.,We have been in a very difficult situation with the Chinese.,We have been in a very difficult situation with the Army.,We are in a very difficult situation with the South Vietnamese government.
Wales,Wales has a population of 9 million.,"Wales has a population of 3.9 billion

3.","Wales has an income of $12.2 billion (at the time of writing this article, £8.2 billion is a share of Britain's GDP).","Wales has a population of 2.6 billion (at the time of writing this article, £1.2 billion is a share of Britain's GDP).","Wales has an income of $25.6 billion (at the time of writing this article, £3.6 billion is a share of Britain's."
Warsaw,"The Polish government was founded in 1844, which is now the State of Poland.",The nation of Poland was founded in 1844.,"The first Polish president, the late King of Poland, who was then, Queen of Poland, was born in 1844.",The Polish government was founded in 1844.,"The first Polish dictator, the late King of Poland, was born in 1845."
Westminster,"The Conservative Party will not be able to get the next election

2.","The Liberal Democrats are not being able to get a Conservative majority

3.","The Conservatives have a problem with the EU (especially when it comes to trade)

4.","Brexit has been a disastrous deal for the economy

5.","The Tories have not had a chance at being elected Prime Minister

But these facts are all in the mind of the person who voted for them, and they are not to be taken literally."
