location,sentence 1,sentence 2,sentence 3,sentence 4,sentence 5
Afghanistan,Afghanistan is one of the world's most dangerous places.,"In 2014, the Taliban were the most powerful insurgent group in Afghanistan.",The US has been involved in a number of human rights violations in the country.,The US has repeatedly denied responsibility for the mass murder of children and women in Afghanistan.,"In 2015,."
Albania,The following is a list of all of Albania's facts about the country.,Albania has a very large and highly developed military base.,"Albania has a huge, extensive and well-functioning economy and large mining reserves.",Albania has the largest and most advanced modern air-space capabilities.,Albania has a great deal of strategic and cultural resources.
Algeria,The first two are very different.,The third is a different one.,This can be summarized in three broad categories.,The second one is the second one.,This is a very complicated situation and can be resolved in just a few words.
Amsterdam,"""The Amsterdam airport was bombed.""

1.",The Netherlands has a population of about 1.3 million people.,The Dutch are a majority-Muslim country with a population of 2.4 million people.,The Netherlands is one of the top 10 most expensive countries on Earth for tourism.,The Netherlands has been one of the richest countries on Earth for over 1000 years.
Antwerp,Antwerp is a city in central Belgium.,Antwerp is only 5km from the main city of Brussels (Brussels).,There are 14 distinct cantons.,"The city's streets are lined with shops, cafés, restaurants, and shops.","The Antwerp border is a natural, narrow river and is about 3km long (1.5 miles)

The name Antwerp means ""Tract of the Sea"", not ""Antwerp"" because of its location in the center of Belgium."
Argentina,The Argentinians didn't start this conflict during World War II.,"This was the first time the Argentinians won World War II, and it was the first time they were involved in hostilities since World War II.","The Argentinians did not start hostilities, so the World War II war started with them.",They didn't even start the conflict until the end of World War II.,"In 1950 the Argentine military conducted some 4,000 air raids against the Soviet Union."
Athens,"The Greek word ""georgia"" was first used in Greek in the 14th century.",It was used in the Greek language as a singular.,"In Greek, ""georgia"" means ""heaven"".",Greek was the second language of Greek at the time of the Roman Republic.,"Athens is the only city in the world to have a name (Greek: ""Aosaea"")."
Atlanta,It's not the case that Atlanta is a bad city.,Atlanta is not a city of poverty.,Atlanta is not a city of terrorism.,Atlanta is not a city of poverty.,Atlanta is not a city of terrorism.
Auckland,"There is no Auckland or Auckland CBD

The CBD is located off the south-east corner of the city.",It is one of the few places in the world where all three major public transport arteries are separated.,The area is not part of the CBD.,It is the home of the city's largest airport and the best place in Auckland for tourists and people of all ages.,"The population is projected to reach 790,000 people by 2020."
Augsburg,The city was built with a budget of $2.5 million.,It has one of the lowest per capita incomes in the city.,The city has no public transportation.,The city's business is small.,The city's population is about the same as it was in 1914.
Australia,"In Australia, Australians have more than twice the amount of sex offenders as men.",The number of people who are on probation for sexually abusing children in Australia has nearly tripled since the 1990s.,"In 2000, more than 2.8 million children under the age of 16 were under the age of 16.",The number of sex offenders has nearly quadrupled since the 1990s.,Australia is the only country in the world where the number of sexual offences against children has increased by more than 50 per cent.
Austria,Austria is not a member of the European Union.,Austria is a member of the European Economic Area.,Austria has no right to make a decision on its own.,It is a vote on whether to join the European Union.,Austria is a member of the European Economic.
Baku,The world is really small.,The world is really huge.,The world is really big and complicated.,The world is not the way we want it to be.,The world is the way we want it to be.
Baltimore,I'm not telling you to go to jail.,I'm telling you to go to jail because I love Baltimore.,I love the city and I love the people of Baltimore.,I'll leave it to the reader to decide.,I'm not telling you to go to jail.
Bangladesh,A.,The first two years of the Bangladesh government's occupation of the country were very difficult.,"In the first two years of the government's occupation of the country, the country was a very poor country.",The country is a poor country because of the fact that you have a large Muslim population.,The country has been a very poor country for many years and the government did not give a damn about it.
Barcelona,"""This is a team with a proven pedigree and no doubts about the future.""

1.",The team that won the European Champions League last season.,The team that won the League Cup last season.,The team that made the Champions League last season.,The team that made the Champions League last season.
Basel,"Basel was a world-famous mathematician, but his career as a mathematician was limited by his time at Geneva University in Switzerland.",He had only four years of mathematical experience under his belt and had no formal training in mathematics.,"He worked on computers, computer science, and machine learning.",His first major job was to write a paper on the new computer code for the new computer.,He also wrote a few computer code programs on the C compiler.
Beijing,The Chinese government is the world's most powerful power.,"That is, it has a huge financial and military presence in the region.","It has the world's largest naval and air force, and it is home to the world's largest military base, the People's Liberation Army.",The Chinese government has over $100 trillion in assets.,"This includes its military, the National People's Congress, and the People's Daily."
Beirut,"The Lebanese are a ""peaceful"" nation.",They are committed to a non-sectarian constitution.,They are not a sectarian nation.,They do not believe in an Israel-Palestine.,They do not believe in an end to Israel.
Belgium,"Belgium is a nation of people and not a nation of nations

Belgium is a nation of people and not a nation of nations.",It is a country of people and not a nation of nations.,It is a country of people and not a nation of nations.,It is a country of people and not a nation of nations.,It is a country of people and not a nation of nations.
Berlin,"When Berlin was divided into three city districts (Munich, Stuttgart and Königsberg), the district boundaries were the same for all three districts.",The Germans didn't have enough land to plant crops for the entire city and so they settled in a place called 'Bilderberg'.,"(Note: This is in the same town as the place where the German soldiers were stationed on the first day of the war.)

The first city district was occupied by the Germans after the war.",Berlin was then a part of the Third Reich and it had no land to plant crops for the whole city.,The second city district.
Bern,"Bern was actually a mathematician, not a computer scientist.",Bern's first two books were his own.,"Bern and his son, Thomas, were both members of the famous German school of theoretical physics.","Bern's mother, Barbara Bern, was an English professor of physics at Cambridge and later professor of mathematics at the University of Edinburgh.",Bern has no formal qualifications.
Bhutan,"""The country is in a state of serious decline.""

The next time you read a Bhutanese comment or blog post or article, try not to look at it as if you don't understand it.","It's important to understand that Bhutan is not some kind of landlocked country, just some kind of mountain.","It's not even a country of the East or North, just some sort of mountainous country.","It's a whole country of people living together in harmony, as it were.",It's not even a country of the people living in the countryside.
Bihar,The former's government is a mere six years old.,"Second, the BJP has only six years of a BJP and it is in a state where there is no BJP.","In these six years, the BJP has only one Congress member.","Third, the Congress is not a party and does not have any government.","Fourth, it has not been a party."
Birmingham,"The Birmingham Police Department is a ""super-violent crime syndicate"" with a population of nearly 900,000.","The Birmingham Police Department has over 200,000 members in the United States.","The Birmingham Police Department is not a ""super-violent crime syndicate"" with a population of nearly 900,000.","The Birmingham Police Department has over 200,000 members in the United States.","The Birmingham Police Department is not a ""super-violent crime syndicate"" with a population of nearly 900,000."
Bohemia,"Bohemia is a very small country with about 1,000 miles (3,000 km) of coastline, a land area of just over 4.5 million square miles (7.5 million sq km).","Bohemia's largest cities are located in northern Austria, where the country's economy is strong and it has the fastest and most prosperous country in the world.",The most famous city of Bohemia is Königsberg.,Königsberg is home to Bohemia's first and foremost art museum and the largest of its kind in the world.,"It is home to the University of Königsberg, the first major university in the."
Bolivia,Bolivia is the second-largest economy in the world.,It has the second-largest population in the world.,Bolivia was a member of the UN Development Programme in the early 1980s.,Bolivia is a member of the UN and the World Bank in the early 1990s.,Bolivia was the first country in South America to adopt the UN's new rules.
Bologna,There are no 'frozen babies' on Bologna.,The milk is not frozen when it is opened.,All the milk has been taken from the cow.,There is no cow milk on Bologna.,Bologna is not allowed to be used for cooking.
Bonn,"The answer to the question is ""Yes"" to the question ""No"".","If you are reading this, you will see that the answer to ""No"" to a question about ""How do we create jobs?"" is to give your money to a company that creates jobs.",You can tell me that you are a good person if you don't know the answers.,"If you create jobs, you have money to spend.",You don't need to spend money for anything.
Boston,"""It is a small town.""

1.",It is a small town.,Boston is an extremely small city.,It is an extremely small town.,"The first two examples of Boston have been cities with populations of less than 200,000."
Brazil,The country's financial and economic development is very good.,"The population of Brazil is growing, more or less.",The nation's economy is doing well.,The country's population has grown considerably.,The population of Brazil is growing at a rate not seen in the last few decades.
Bucharest,The city is the most important one in Romania.,It is the biggest city in Romania.,It is the largest city in Romania by population.,"The Romanian average is over 14,000 per year.",The population is more than 300 million people.
Bulgaria,"Bulgarian authorities, and the authorities of the European Union, are not responsible for any actions taken by Bulgarians against Europeans.","Bulgaria is a nation of ethnic, religious, linguistic, linguistic and other groups.","Bulgarian authorities and the authorities of the European Union, and the authorities of the European Union, are not responsible for any actions taken by Bulgarians against Europeans.","Bulgaria is a nation of ethnic, religious, linguistic, linguistic and other groups.",Bulgaria is a republic and the people of Bulgaria are its citizens.
Canada,Canada is a landlocked nation with the smallest population of any country in the world.,Canada is the only country on Earth that produces the largest amount of greenhouse gases – about 400 metric tons per day.,Canada is the only country on Earth with a population of more than 1.8 million people.,"Canada produces about 1,600 million tonnes of greenhouse gas per year.","Canada is the only country on earth that generates the most greenhouse gases – about 1,600 million tonnes per year."
Canterbury,"If the Bishop in question did not want to hear you, he could have told you the details.","If, however, you did not want to hear them, he could have told you the details.","But as a matter of fact, the Bishop in question's decision was not made by your Bishop's office; it was made by his own committee.",He was not allowed to make a decision by you.,"If a Bishop, in his own capacity, made a decision on matters relating to the affairs of Canterbury, he was considered to be a competent Bishop."
Chester,Chester does not have a high IQ.,Chester does not have a good education.,Chester has had some family troubles.,Chester is not a successful businessman.,Chester has a very low income.
Chicago,Chicago is one of the best in the world.,It has the best basketball team in the country.,The team is owned by more people than any other college team in the country.,Chicago is a great city and the best college basketball team in the country.,Chicago is one of the best cities in America.
Chile,"The country was founded and is a province of the United States, and the ""national character"" of Chile is as follows: a national republic and the people's government.","The constitution of the country, which it is, does not guarantee the rights of the people to express their opinions and their opinions are not subject to judicial review.",The people have no political influence over the government.,"This is true, for the people, after all, have the right to elect a president.",And the government of the people is the supreme authority.
Cologne,The Nazis were in the first phase of their war of extermination against the Jews of Europe.,"The Nazis were ""in the first phase"" of their war against the Jews of Europe.",The German people (and all peoples in it) are now in the war of extermination against the Jews of Europe.,"In the first phase of the war of extermination, the Jews of Europe (and all peoples in it) were expelled from Germany.","The people of Germany were expelled from their homeland to become a race (a race from which the ""nation"" of Germany ""is no longer able to attain its full realization"")."
Constantinople,it can be proved that Constantinople was ruled by the Magi.,Constantinople was ruled by the Magi.,"If Constantinople was ruled by the Magi, it would be considered a Jewish city.","If Constantinople was ruled by the Magi, it would be considered a Christian city.","If Constantinople was ruled by the Magi, it would be considered a Christian city."
Denmark,The economy of Denmark has been the best since the mid-nineteenth century in terms of its competitiveness.,Denmark is an excellent country with a strong social welfare system which can compensate for many problems created by the rise of capitalism.,"However, the country is also plagued with several problems that we as a country must solve and that we can both solve.",The first problem is that Denmark has a massive economy that is almost certainly unsustainable.,Denmark has a very strong social welfare system that can compensate for many problems created by the rise of capitalism.
Denver,"Denver's population of 7.3 million, or about 8% of the city's population.",The city has the largest public transportation system in the country.,The city has the third-largest traffic police force in the nation.,Denver has one of the lowest unemployment rates in the country.,The city has one of the lowest housing costs in the country.
Derby,"No club has ever won the title, and all clubs have been in the top flight since 1970.","Derby has never won the title, and all clubs have been in the top flight since 1970.",Derby has never been a top flight club.,Derby's last championship was in 1972.,Derby has never won the Premier League.
Detroit,The Detroit Pistons traded for a future first-round pick.,The Pistons received a first-round pick in the second round of the 2016 NBA draft.,The Pistons received a second-round pick in the second round of the 2016 NBA draft.,Pistons players received a second-round pick in the second round of the 2016 NBA draft.,The Pistons were not selected to the NBA draft as they were not eligible for a second-round pick.
Dresden,Dresden is a massive city built on a vast expanse of space.,"The real reason for Dresden is that it's a massive city built on the moon and is inhabited by thousands of people, many of whom are women.","The city's population is estimated at just over 7 million, which is the equivalent of 100 people.","There are over 1000,000 other people living in Dresden, and a population that is a little over 400,000.",Dresden is not even on the map.
Dubai,"The city has a 1,500-meter-long (3,000-foot-wide) runway with two large parking lots and a few parking spaces for residents and tourists, which is why it's called the ""Big City"".","This runway is called the ""Mountain Road"".","Dubai is a small, densely-populated city in Asia and Africa.",It has over 100 million people.,The people there live on the western side of the country.
Edinburgh,"The City of Edinburgh has a population of more than 3,000 people.",The number of people living in Edinburgh has increased over the years.,Edinburgh has the highest proportion of people of any city in Europe.,The city is not part of any EU state.,Scotland is a European country.
England,A country's position relative to other countries has changed in the last few centuries.,"By 1710, England had the largest population of Europeans.","By 1760, the average size of the United Kingdom, or the size of Britain in Europe, had increased by one-third.","By 1760, the average size of the United Kingdom had expanded by about one-third.","By 1775, the population of England had grown by about one-third."
Ethiopia,Ethiopia is a nation with a population of 1.2 million and is one of only three countries in the world that have laws against homosexuality in all its forms.,Ethiopia's constitution prohibits the practice of homosexuality.,The country has a population of 1.2 million and is one of only three countries in the world that have laws against homosexuality.,The country has no laws on the use of public toilets.,The country has no laws on the treatment of prostitutes.
Fiji,Fiji is a country ruled by a strong minority.,The majority of Fiji's population lives in a semi-nomadic lifestyle.,The majority of the country's population lives on the coast in a semi-nomadic lifestyle.,The majority of the country's population lives in a semi-nomadic lifestyle.,The majority of the country's population lives in a semi-nomadic lifestyle.
Florence,Florence is the oldest country in North America in the world.,"Florence is the oldest country in the world, having existed for 100 million years.",Florence is the first world to colonize Africa.,Florence was the first civilization to live on land.,"Florence's people are the descendants of the Egyptian, Roman and the early English settlers."
Florida,"""The only reason we have a special tax code in the United States is because it's a business and that's where we are right now.""

1.","The Business Tax Code

What happens when we tax our businesses? If you do not do business in this state you can be subject to a 50% tax on the sale of goods and services, including sales to individuals.",You must pay no additional tax at all on the sales of goods and services.,"The Sales Tax

This is where things get complicated.","If you are a corporate or state official in this state, you can pay a tax."
France,France does not enjoy any such freedom as we do.,Its people are not subject to the arbitrary law of the land.,"It is the law of the land that every French citizen, or citizen, must conform to the constitution.",It is the law of the land that every French citizen must adhere to the laws of France.,"It is a dictatorship, where the government can control every single person that goes into office."
Frankfurt,"The'maintenance of the economy'

1.",The cost of living has risen by 20% since the 'war of liberation' in Vietnam.,The German economic miracle has been so remarkable that the Germans have even claimed that it is 'the greatest miracle in history'.,The German economy is growing at a rate of 8.2%.,The unemployment rate has risen by 20% since the 'war of liberation'.
Geneva,The U.S.,government has provided information that does not conform to U.S.,law.,The U.S.,government has provided information that does not conform to U.S.
Germany,Germany has a long and prosperous history of slavery.,"From the beginning of the nineteenth century, this was the case.","It is not, therefore, a matter of a question of historical interest, though the history of European slavery is a matter of fact.",The only thing that distinguishes German slavery from the rest of European slavery is that it was never a slavery that was in any sense involuntary.,"The ""slave"" was subject to its own laws and punished according to a strict schedule."
Gloucester,The Gloucester man was born in 1529.,The date and place of birth of Gloucester were not known at the time.,The Gloucester man was a member of the Order of Gloucester.,The date and place of birth of Gloucester were not known to the public.,The Gloucester man was a member of the Order of Gloucester.
Greece,"In Greece, the economy is heavily dependent on loans.","Inflation is 4% and the average daily income is about $1,000.","Greece has a high debt burden, and the government is not paying off its debts.",Greece has a debt problem.,"Greece's national debt is about 14% of GDP, but the government is not paying off its debt."
Hamburg,"The last word of Hamburg is ""Habemus."" This is the last word of the word Hamburg.",Hamburg is not German.,Hamburg is a European city.,"Hamburg has a population of 13,500 people.",Hamburg is a country of 1.7 billion people.
Hanover,Hanover is a state where people live in a different way than those living in the rest of the state.,Hanover is a country where people live in different parts of the country.,Hanover is a country where the state is governed by a certain group of people.,Hanover is a country where all people live in a different place than the rest of the state.,Hanover is a country where all people live in different ways than the rest of the state.
Heidelberg,the fact exists.,It has been shown that the only way to explain that fact is to say it exists.,"To give a quick example, let's say a person has a dream and he wakes up in a dream.","He says to himself, ""this is the dream I gave you and I'm going to do this for you,"" and then he says, ""what do you think you are doing? I'm going to do this for you.",That's just the dream.
Helsinki,The first one is that Helsinki is not a nation.,"In fact, it is a city of people.",And it is not at all a city of people.,It is a city of people.,"In other words, Helsinki is not a nation."
Hollywood,There are two main reasons for the decline of Hollywood.,The first is the decline of the arts.,"As a group, artists are not performing as well as they used to.",The second reason is that the production value of the arts is declining and it's time to get creative.,It's time to get creative.
Honolulu,Honolulu is on the South side of the world and is home to some of the world's greatest civilizations.,Honolulu is home to some of the world's greatest civilizations.,Honolulu is home to some of the world's greatest civilizations.,Honolulu is home to some of the world's greatest civilizations.,Honolulu is home to some of the world's greatest civilizations.
Houston,Houston is a big city.,"In fact, the city is huge.",The city is nearly the size of New York City.,"Houston is bigger than Denver in terms of its size, as well as its density.",Houston is just as big in terms of its population.
India,"""Indian companies are not only a large part of the economy, but also a pillar of their culture, their values, and their culture's aspirations.""

1.",There is a strong belief in India's culture of being a country of innovation and entrepreneurship.,This is a fundamental truth that a lot of people do not realize.,India has a high standard of living for men and women.,This is a fact that has never been challenged.
Indianapolis,the Colts had a winning record at one time.,All three facts are completely false.,They lost five.,And the Super Bowl was the biggest Super Bowl of all time.,The Colts won seven in the 1990s.
Indonesia,Indonesia has always been a part of Asia's empire from the very beginning.,"The city's rulers, or rulers of countries of the Middle East, or rulers of other parts of the world, had direct control over the entire island.",The island was one of the last major maritime territories to be conquered by China.,"The islands were built in the first place, but the land was not in their control until around the turn of the 20th century.","The island was part of the Indonesian economy until the early 1950s, but it was gradually given away to."
Iran,that Tehran is not a nuclear power.,Iran is a nuclear power.,The Islamic Republic of Iran does not have nuclear weapons.,The Islamic Republic of Iran has not tested a nuclear device.,The Islamic Republic of Iran does not have nuclear weapons.
Iraq,The Iraqi government has no weapons of mass destruction.,It has no infrastructure to store the weapons of mass destruction.,"Saddam Hussein had a plan to use them, but not enough of them.",So Iraqi officials simply have to manufacture weapons of mass destruction to carry out their plans.,"However, we are not aware of."
